{
  "schemaVersion": 1,
  "traceId": "trace_shopify_https_static_vector",
  "provider": "shopify-https",
  "startedAt": "2026-08-17T22:10:00Z",
  "envelopes": [
    {
      "id": "env_shopify_https_static_vector",
      "provider": "shopify-https",
      "eventType": "orders/create",
      "deliveryId": "b54557e4-bdd9-4b37-8a5f-bf7d70bcd043",
      "receivedAt": "2026-08-17T22:10:00Z",
      "request": {
        "method": "POST",
        "url": "http://localhost:4242/webhooks/shopify",
        "headers": [
          {
            "name": "X-Shopify-Hmac-SHA256",
            "value": "x3r6cWQNZ+gA1NUGkW2ENnLCVNStl20slv8LA3Kj/hQ="
          },
          {
            "name": "x-shopify-topic",
            "value": "orders/create"
          },
          {
            "name": "X-SHOPIFY-WEBHOOK-ID",
            "value": "b54557e4-bdd9-4b37-8a5f-bf7d70bcd043"
          },
          {
            "name": "X-Shopify-API-Version",
            "value": "2026-07"
          },
          {
            "name": "X-Shopify-Shop-Domain",
            "value": "wirelint-test.myshopify.com"
          },
          {
            "name": "X-Shopify-Event-Id",
            "value": "7b8c9d0a-1234-5678-90ab-cdef12345678"
          }
        ],
        "headersCompleteness": "complete",
        "rawQuery": "",
        "queryFidelity": "exact",
        "query": [],
        "bodyFidelity": "exact",
        "rawBodyBase64": "eyJpZCI6MTIzNDU2Nzg5MCwibmFtZSI6IiMxMDAxIn0=",
        "decodedBody": {
          "id": 1234567890,
          "name": "#1001"
        }
      },
      "response": {
        "status": 200,
        "headers": [],
        "headersCompleteness": "complete",
        "bodyFidelity": "exact",
        "rawBodyBase64": "",
        "durationMs": 37
      }
    }
  ],
  "observations": []
}
